{
  "schema_version": "1.0.0",
  "record_type": "RELEASE_CANDIDATE_PUBLICATION_DRY_RUN_OPERATOR_APPROVAL_PACKET_v1",
  "packet_id": "release-candidate-package-publish-dry-run-operator-approval-packet-v1",
  "packet_version": "v1",
  "candidate_id": "release_candidate_package_publish_dry_run_v1",
  "candidate_type": "dry_run",
  "approval_packet_status": "static_template_valid_blocked",
  "admission_status": "unadmitted",
  "approval_request_ready": false,
  "operator_approval_granted": false,
  "approval_phrase_present": false,
  "dry_run_admitted": false,
  "receipt_issued": false,
  "publication_admitted": false,
  "real_execution_admitted": false,
  "production_ready_claimed": false,
  "generated_from_static_artifacts_only": true,
  "source_artifacts": {
    "candidate_matrix_ref": "examples/execution-admission/execution_admission_candidate_matrix_v1.json",
    "preflight_contracts_ref": "examples/execution-admission/execution_admission_preflight_contracts_v1.json",
    "preflight_proof_packages_ref": "examples/execution-admission/execution_admission_preflight_proof_packages_v1.json",
    "readiness_rollup_ref": "examples/execution-admission/execution_admission_readiness_rollup_v1.json",
    "dry_run_plan_ref": "examples/execution-admission/release_candidate_package_publish_dry_run_plan_v1.json",
    "dry_run_receipt_contract_ref": "examples/execution-admission/release_candidate_package_publish_dry_run_receipt_contract_v1.json",
    "blocked_unissued_receipt_ref": "examples/execution-admission/release_candidate_package_publish_dry_run_receipt_blocked_v1.json",
    "admission_blocker_checklist_ref": "examples/execution-admission/release_candidate_package_publish_dry_run_admission_blockers_v1.json",
    "production_readiness_report_ref": "examples/production-readiness-report/max_biped_v1_production_readiness_report_pass.json",
    "noop_receipt_status_ref": "examples/execution-admission/release_candidate_package_receipt_noop_execution_admission_decision_approved.json"
  },
  "source_artifact_validation_status": {
    "candidate_matrix_status": "pass",
    "preflight_contracts_status": "pass",
    "preflight_proof_packages_status": "pass",
    "readiness_rollup_status": "pass",
    "dry_run_plan_status": "pass",
    "dry_run_receipt_contract_status": "pass",
    "blocked_unissued_receipt_status": "pass",
    "admission_blocker_checklist_status": "pass",
    "production_readiness_status": "pass",
    "noop_receipt_status": "pass"
  },
  "operator_review_summary": [
    "Candidate is not approval-ready today.",
    "Approval phrase must not be used yet.",
    "Admission blocker checklist remains blocked.",
    "Approval decision is intentionally missing by design in this template slice.",
    "Dry-run has not been admitted, has not run, and no dry-run receipt has been issued.",
    "Publication and real execution remain blocked, and production_ready is not claimed."
  ],
  "approval_blocker_summary": [
    "missing_approval_decision",
    "approval_request_ready_false",
    "dry_run_not_admitted",
    "dry_run_not_executed",
    "receipt_not_issued",
    "rollback_cleanup_evidence_missing",
    "publication_surfaces_blocked_by_policy"
  ],
  "required_operator_review_items": [
    "candidate_identity_and_candidate_type",
    "current_admission_status",
    "source_artifact_validation_summary",
    "admission_blocker_checklist_summary",
    "dry_run_plan_summary",
    "dry_run_receipt_contract_summary",
    "blocked_unissued_receipt_summary",
    "required_approval_phrase",
    "required_future_validation_commands",
    "rollback_noop_cleanup_expectations",
    "forbidden_surfaces",
    "forbidden_outputs",
    "forbidden_paths",
    "operator_decision_options",
    "post_approval_control_expectations"
  ],
  "required_validation_commands": [
    "tools/execution-admission/validate_execution_admission_candidate_matrix.py",
    "tools/execution-admission/validate_execution_admission_preflight_contracts.py",
    "tools/execution-admission/validate_execution_admission_preflight_proof_packages.py",
    "tools/execution-admission/validate_execution_admission_readiness_rollup.py",
    "tools/execution-admission/validate_release_candidate_publication_dry_run_plan.py",
    "tools/execution-admission/validate_release_candidate_publication_dry_run_receipt.py",
    "tools/execution-admission/validate_release_candidate_publication_dry_run_admission_blockers.py",
    "tools/audit/verify_sandbox_writer_safety.py",
    "tools/release-lane/prove_pilot_release_chain.py"
  ],
  "expected_future_receipt_contract": {
    "receipt_contract_ref": "examples/execution-admission/release_candidate_package_publish_dry_run_receipt_contract_v1.json",
    "receipt_type": "release_candidate_package_publish_dry_run_receipt_v1",
    "receipt_contract_status_expected": "static_contract_valid_blocked"
  },
  "rollback_or_cleanup_expectations": [
    "No-op cleanup evidence is required for any future admitted dry-run.",
    "Future receipt package must prove no publication endpoint invocation.",
    "Future receipt package must prove no spawn and no blocked runtime/tool execution."
  ],
  "blocked_surface_attestations": [
    "publication_surfaces_blocked_by_policy",
    "execution_surfaces_blocked_by_policy",
    "cache_live_db_access_blocked_by_policy",
    "production_engine_write_blocked_by_policy",
    "authoritative_id_claims_blocked_by_policy"
  ],
  "forbidden_actions": [
    "publish_operation",
    "spawn_operation",
    "production_path_writes",
    "engine_path_writes",
    "cache_live_db_access",
    "authoritative_source_uuid_claims",
    "authoritative_asset_id_claims",
    "authoritative_product_id_claims"
  ],
  "forbidden_outputs": [
    "publish_operation",
    "spawn_operation",
    "production_path_writes",
    "engine_path_writes",
    "cache_live_db_access",
    "authoritative_source_uuid_claims",
    "authoritative_asset_id_claims",
    "authoritative_product_id_claims"
  ],
  "forbidden_paths": [
    "production_path_category",
    "engine_path_category",
    "cache_live_db_category",
    "destructive_cleanup_category"
  ],
  "approval_phrase_required": "APPROVE EXECUTION ADMISSION release_candidate_package_publish_dry_run_v1",
  "approval_decision_reference": null,
  "approval_decision_fields": {
    "approver_identity": null,
    "approval_timestamp_utc": null,
    "approval_phrase_exact": null,
    "approved_candidate_id": null,
    "approval_scope": null,
    "approval_limitations": null,
    "source_packet_hash": null,
    "source_artifact_hashes": null,
    "validation_summary_at_approval": null,
    "rollback_acceptance": null,
    "safety_attestation": null
  },
  "operator_decision_options": {
    "allowed_options": [
      "do_not_approve",
      "request_more_evidence",
      "request_safety_review",
      "approve_later_with_exact_phrase"
    ],
    "default_option": "do_not_approve"
  },
  "required_post_approval_controls": [
    "Future approval must include exact candidate-scoped phrase only.",
    "Future approval must preserve blocked publication surfaces.",
    "Future approval must preserve blocked real execution/publication admission states for all other candidates.",
    "Future admitted dry-run must still remain non-publication and sandbox bounded."
  ],
  "unsafe_claims_detected": false,
  "safest_next_action": "Keep packet template blocked and continue evidence/completeness preparation without requesting approval.",
  "safety_posture": {
    "source_uuid_status": "not_authoritative",
    "asset_id_status": "not_authoritative",
    "product_id_status": "not_authoritative"
  },
  "safety_notes": [
    "This packet is a static template only and does not grant approval.",
    "This packet does not mark approval_request_ready or operator_approval_granted.",
    "This packet does not admit dry-run execution, issue receipts, or allow publication."
  ]
}
